{
  "plugin_schema_version": "1.0.0",
  "question_id": "Ana18",
  "category": "C",
  "operation": "C_manual",
  "description": "",
  "intent": "",
  "params": {
    "actions": [
      {
        "type": "add_point",
        "filled": true,
        "color": "#DC2626",
        "size_pt2": 50,
        "edge_linewidth_pt": 1,
        "id": "board_point_1",
        "xy": [
          0,
          0
        ]
      },
      {
        "type": "set_curve_style",
        "target": "curve_001",
        "color": "#000000",
        "linestyle": "dashed",
        "linewidth_pt": 1
      }
    ]
  }
}
